{
  "format": "suilang-boss-pack",
  "version": 1,
  "id": "ahe-example",
  "name": "阿禾",
  "role": "田野的守夜人 · 老板娘",
  "title": "替稻子听风的人",
  "en": "AHE · FIELD WATCHER",
  "accent": "#b8ca8f",
  "portrait": "portrait.png",
  "lines": [
    "夜露落下来之前，我会把最后一盏灯点上。",
    "稻子不会说话，但它们记得每一阵风的方向。",
    "你割累了就歇一歇，田不会趁你睡觉时跑掉。",
    "我不太会算账，不过谁帮过我，我都记得。",
    "新米下锅的时候，整间铺子都会香起来。",
    "要是走夜路，就沿着有蛙声的那条田埂走。",
    "哥哥姐姐们把远方带走了，我把家留在这里。",
    "别嫌旧镰刀钝，它见过比我们更长的秋天。",
    "今夜的月亮像一枚刚磨好的镰刀。",
    "有空的话，替我看看西边那块田的水够不够。",
    "我把祝福压在米袋底下了，你走的时候记得拿。",
    "灯还亮着，再坐一会儿吧。"
  ],
  "author": "示例作者",
  "license": "MIT",
  "note": "示例角色。请替换成你自己的原创角色。",
  "rankLines": {
    "S": "今晚的灯，为你多亮一会儿。",
    "A": "割得漂亮，稻子都在替你鼓掌。",
    "B": "手上有风，心里有田。",
    "C": "不急，田埂还长。",
    "D": "先歇歇吧，明天再来。"
  }
}
